[
  {
    "event_id": "synthetic-product-approved-event",
    "entity_type": "product",
    "entity_id": "synthetic-product-ready-001",
    "from_state": "PRODUCT_REVIEW_REQUIRED",
    "to_state": "PRODUCT_READY",
    "actor_type": "human",
    "actor_id": "synthetic-reviewer",
    "occurred_at": "2026-08-23T12:00:00Z",
    "evidence_refs": ["synthetic-factory-sheet-001"],
    "gate": "gate_01_truth",
    "approval_ref": "synthetic-approval-001"
  },
  {
    "event_id": "synthetic-product-rejected-event",
    "entity_type": "product",
    "entity_id": "synthetic-product-draft-001",
    "from_state": "PRODUCT_REVIEW_REQUIRED",
    "to_state": "PRODUCT_REVISION_REQUIRED",
    "actor_type": "human",
    "actor_id": "synthetic-reviewer",
    "occurred_at": "2026-08-23T12:01:00Z",
    "evidence_refs": ["synthetic-product-review-002"],
    "gate": "gate_01_truth",
    "approval_ref": "synthetic-product-rejection-001"
  },
  {
    "event_id": "synthetic-product-resubmitted-event",
    "entity_type": "product",
    "entity_id": "synthetic-product-draft-001",
    "from_state": "PRODUCT_REVISION_REQUIRED",
    "to_state": "PRODUCT_REVIEW_REQUIRED",
    "actor_type": "agent",
    "actor_id": "synthetic-product-agent",
    "occurred_at": "2026-08-23T12:02:00Z",
    "evidence_refs": ["synthetic-product-revision-001"]
  },
  {
    "event_id": "synthetic-content-approved-event",
    "entity_type": "content",
    "entity_id": "synthetic-content-001",
    "from_state": "CONTENT_REVIEW_REQUIRED",
    "to_state": "CONTENT_APPROVED",
    "actor_type": "human",
    "actor_id": "synthetic-reviewer",
    "occurred_at": "2026-08-23T12:03:00Z",
    "evidence_refs": ["synthetic-content-review-003"],
    "gate": "gate_01_truth",
    "approval_ref": "synthetic-content-approval-001"
  },
  {
    "event_id": "synthetic-content-resubmitted-event",
    "entity_type": "content",
    "entity_id": "synthetic-content-001",
    "from_state": "CONTENT_REVISION_REQUIRED",
    "to_state": "CONTENT_REVIEW_REQUIRED",
    "actor_type": "agent",
    "actor_id": "synthetic-content-agent",
    "occurred_at": "2026-08-23T12:04:00Z",
    "evidence_refs": ["synthetic-content-revision-001"]
  },
  {
    "event_id": "synthetic-quotation-approved-event",
    "entity_type": "quotation",
    "entity_id": "synthetic-handoff-001",
    "from_state": "QUOTE_REVIEW_REQUIRED",
    "to_state": "QUOTE_APPROVED",
    "actor_type": "human",
    "actor_id": "synthetic-sales-reviewer",
    "occurred_at": "2026-08-23T12:05:00Z",
    "evidence_refs": ["synthetic-quote-review-001"],
    "gate": "gate_02_quote",
    "approval_ref": "synthetic-quote-approval-001"
  },
  {
    "event_id": "synthetic-quotation-rejected-event",
    "entity_type": "quotation",
    "entity_id": "synthetic-handoff-review-001",
    "from_state": "QUOTE_REVIEW_REQUIRED",
    "to_state": "QUOTE_REVISION_REQUIRED",
    "actor_type": "human",
    "actor_id": "synthetic-sales-reviewer",
    "occurred_at": "2026-08-23T12:06:00Z",
    "evidence_refs": ["synthetic-quote-review-002"],
    "gate": "gate_02_quote",
    "approval_ref": "synthetic-quote-rejection-001"
  },
  {
    "event_id": "synthetic-quotation-resubmitted-event",
    "entity_type": "quotation",
    "entity_id": "synthetic-handoff-review-001",
    "from_state": "QUOTE_REVISION_REQUIRED",
    "to_state": "QUOTE_REVIEW_REQUIRED",
    "actor_type": "human",
    "actor_id": "synthetic-sales-user",
    "occurred_at": "2026-08-23T12:07:00Z",
    "evidence_refs": ["synthetic-quote-revision-001"]
  },
  {
    "event_id": "synthetic-lead-opportunity-event",
    "entity_type": "lead",
    "entity_id": "synthetic-lead-001",
    "from_state": "FOLLOW_UP",
    "to_state": "OPPORTUNITY",
    "actor_type": "human",
    "actor_id": "synthetic-sales-user",
    "occurred_at": "2026-08-23T12:08:00Z",
    "evidence_refs": ["synthetic-positive-intent-001"]
  },
  {
    "event_id": "synthetic-lead-won-event",
    "entity_type": "lead",
    "entity_id": "synthetic-lead-002",
    "from_state": "OPPORTUNITY",
    "to_state": "WON",
    "actor_type": "human",
    "actor_id": "synthetic-sales-user",
    "occurred_at": "2026-08-23T12:09:00Z",
    "evidence_refs": ["synthetic-human-outcome-001"]
  },
  {
    "event_id": "synthetic-lead-lost-event",
    "entity_type": "lead",
    "entity_id": "synthetic-lead-003",
    "from_state": "OPPORTUNITY",
    "to_state": "LOST",
    "actor_type": "human",
    "actor_id": "synthetic-sales-user",
    "occurred_at": "2026-08-23T12:10:00Z",
    "evidence_refs": ["synthetic-human-outcome-002"]
  },
  {
    "event_id": "synthetic-delivery-confirmed-event",
    "entity_type": "delivery_confirmation",
    "entity_id": "synthetic-delivery-confirmation-001",
    "from_state": "DELIVERY_CONFIRMATION_PENDING",
    "to_state": "DELIVERY_CONFIRMATION_CONFIRMED",
    "actor_type": "human",
    "actor_id": "synthetic-factory-user",
    "occurred_at": "2026-08-23T12:11:00Z",
    "evidence_refs": ["synthetic-capacity-check-001"],
    "gate": "gate_03_delivery",
    "approval_ref": "synthetic-delivery-approval-001"
  },
  {
    "event_id": "synthetic-delivery-rejected-event",
    "entity_type": "delivery_confirmation",
    "entity_id": "synthetic-delivery-confirmation-002",
    "from_state": "DELIVERY_CONFIRMATION_PENDING",
    "to_state": "DELIVERY_CONFIRMATION_REJECTED",
    "actor_type": "human",
    "actor_id": "synthetic-factory-user",
    "occurred_at": "2026-08-23T12:12:00Z",
    "evidence_refs": ["synthetic-capacity-check-002"],
    "gate": "gate_03_delivery",
    "approval_ref": "synthetic-delivery-rejection-001"
  },
  {
    "event_id": "synthetic-delivery-expired-event",
    "entity_type": "delivery_confirmation",
    "entity_id": "synthetic-delivery-confirmation-003",
    "from_state": "DELIVERY_CONFIRMATION_PENDING",
    "to_state": "DELIVERY_CONFIRMATION_EXPIRED",
    "actor_type": "system",
    "actor_id": "synthetic-workflow-system",
    "occurred_at": "2026-08-23T12:13:00Z",
    "evidence_refs": ["synthetic-timeout-policy-001"]
  }
]
